{
  "case": "python-community-basic",
  "image": "qodana-python-community",
  "description": "Single-file Python project with two planted defects, hermetic run (network: none, no token — Community is free). Proves qodana-python-community builds (base + conda + dist + cli + runtime), loads the Qodana plugin from the dist custom-plugins, and scans a real .py producing SARIF. The Community dist reports the Pro product code (driver QDPY). Driver name + rule ids pinned from CI run 27876312623.",
  "run": {
    "network": "none",
    "extraArgs": ["--no-statistics"]
  },
  "expectExitCode": 0,
  "sarif": {
    "tool": {
      "driverName": "QDPY",
      "driverFullName": "Qodana for Python"
    },
    "schemaValid": false,
    "qodanaSeverityRequired": true,
    "expectations": [
      {
        "ruleId": "PyUnusedLocalInspection",
        "presence": "present",
        "count": ">=1",
        "uriContains": "main.py",
        "pin": "confirmed",
        "guards": [],
        "reason": "The planted `unused = 42` local that is never read surfaces as PyUnusedLocalInspection (pinned from CI run 27876312623; enabled in the Community profile)."
      },
      {
        "ruleId": "PyMethodMayBeStaticInspection",
        "presence": "present",
        "count": ">=1",
        "uriContains": "main.py",
        "pin": "confirmed",
        "guards": [],
        "reason": "`Greeter.shout` never uses `self`, so PyMethodMayBeStaticInspection reports (pinned from CI run 27876312623)."
      }
    ]
  },
  "log": {
    "mustNotContain": [
      { "text": "Problems found loading plugins:", "guards": [] }
    ]
  }
}
