{
  "case": "jvmc-basic",
  "image": "qodana-jvm-community",
  "description": "Single-module Maven project: plain Java + a Kotlin file, three planted defects; network bridge so Qodana auto-downloads projectJDK 17 (Community is free — no license token). Shape guards (tool driver, qodanaSeverity) over one SARIF. Driver name + rule ids are NEEDS-PINNING starting guesses — pin from a CI control run; DuplicatedCode is intentionally omitted (Ultimate-only, absent from the Community profile).",
  "run": {
    "network": "bridge",
    "extraArgs": ["--no-statistics"]
  },
  "expectExitCode": 0,
  "sarif": {
    "tool": {
      "driverName": null,
      "driverFullName": null
    },
    "schemaValid": false,
    "qodanaSeverityRequired": true,
    "expectations": [
      {
        "ruleId": "StringEquality",
        "presence": "present",
        "count": ">=1",
        "uriContains": "Hello.java",
        "pin": "needs-pinning",
        "guards": [],
        "reason": "STARTING-GUESS id: planted `a == b` on String must surface; pin exact id from CI control run."
      },
      {
        "ruleId": "EmptyCatchBlock",
        "presence": "present",
        "count": ">=1",
        "uriContains": "Hello.java",
        "pin": "needs-pinning",
        "guards": [],
        "reason": "STARTING-GUESS id: planted empty catch must surface; pin exact id from CI control run."
      },
      {
        "ruleId": "KotlinConstantConditions",
        "presence": "present",
        "count": ">=1",
        "uriContains": "Demo.kt",
        "pin": "needs-pinning",
        "guards": [],
        "reason": "STARTING-GUESS id: an always-true `name != null` on a non-null val must report a Kotlin constant-condition inspection; pin the EXACT rule id and confirm it is enabled in THIS image's default Community profile from the CI control run — do not trust the guess."
      }
    ]
  }
}
